{
  "reviewer": "threat-modeler",
  "schema_version": "1.0",
  "iteration": 3,
  "status": "ok",
  "verdict": "approve_with_warnings",
  "findings": [
    {
      "severity": "critical",
      "category": "security",
      "file": "architecture",
      "line": null,
      "finding": "CRITICAL-1 (Round 1): Blanket `Bash(OPENAI_API_KEY=:*)` permission entry. Status: FIXED. README.md line 29 now specifies `Bash(ai_review_openai.sh:*)`, scoped to the specific script. No new issue.",
      "suggested_fix": "N/A — FIXED"
    },
    {
      "severity": "critical",
      "category": "security",
      "file": "architecture",
      "line": null,
      "finding": "CRITICAL-2 (Round 1): Unvalidated marker content enabling path traversal exfiltration to api.openai.com. Status: FIXED. Python path uses re.fullmatch(r'[a-zA-Z0-9_-]+', feature_name); shell uses [[ ! \"$feature\" =~ ^[a-zA-Z0-9_-]+$ ]]; verification criterion 4 explicitly tests '../etc/passwd' injection. No new issue.",
      "suggested_fix": "N/A — FIXED"
    },
    {
      "severity": "medium",
      "category": "security",
      "file": "architecture",
      "line": null,
      "finding": "MEDIUM-1 (Round 1, unaddressed): Plan-mode sends the entire README.md to OpenAI with no size guard. A README.md with secrets in code blocks or abnormally large content (50K+ tokens) is sent verbatim. Not documented as an accepted risk separately from the generic diff-content risk row.",
      "suggested_fix": null
    },
    {
      "severity": "medium",
      "category": "security",
      "file": "skills/feature-development/ai_review_json_openai.py",
      "line": null,
      "finding": "MEDIUM-2 (Round 1, unaddressed): TLMFORGE_OPENAI_MODEL env var is passed to the OpenAI SDK without validation. The SDK serializes it as a JSON body field, providing implicit sanitization against most injection, but a model name containing control characters or newlines could behave unexpectedly across SDK versions.",
      "suggested_fix": null
    },
    {
      "severity": "medium",
      "category": "security",
      "file": "architecture",
      "line": null,
      "finding": "Round 2 MEDIUM (accepted risk): Silent-skip policy creates a stealthy reviewer-suppression window. When the reviewer is configured and expected, any failure silently removes it with no in-workflow signal. Accepted as same risk profile as existing Gemini reviewer.",
      "suggested_fix": null
    },
    {
      "severity": "nit",
      "category": "architecture",
      "file": "specs/multi-llm-reviewers/README.md",
      "line": 337,
      "finding": "Round 2 NIT-1 (NOT FIXED): Risk audit table LOW row still says 'Results in status=error instead of status=skipped; correct graceful behavior.' After the all-failures-skip policy, status=error from a TOCTOU auth failure is a policy violation. Phase 1 constraint section (line 207) correctly specifies status=skipped. The table contradicts the constraints; an implementer reading the table in isolation gets the wrong behavior spec.",
      "suggested_fix": "Update the LOW risk table row to: 'Results in status=skipped (per all-failures-skip policy); failure reason logged to ~/.cache/tlmforge/llm_reviewer.log. Correct graceful behavior.'"
    },
    {
      "severity": "nit",
      "category": "security",
      "file": "specs/multi-llm-reviewers/README.md",
      "line": 122,
      "finding": "Round 2 NIT-2 (NOT FIXED): Sensitive surface inventory states '--output path: no traversal check needed (script writes to where called from, not user-supplied arbitrary paths).' This assertion is false — --output IS a user-supplied CLI argument. The actual partial mitigation (parent-dir existence check exits 64) is not stated. Severity stays low (requires compromised orchestrator) but the false justification should not stand in documentation.",
      "suggested_fix": null
    },
    {
      "severity": "nit",
      "category": "security",
      "file": "skills/feature-development/ai_review_json_openai.py",
      "line": null,
      "finding": "NEW N-1: Log writes to ~/.cache/tlmforge/llm_reviewer.log use raw exception text without newline normalization. An openai.APIError message containing embedded newlines produces multi-line log entries that break grep-based debugging. Not a security threat (local file, attacker would need to control API error messages). Implementers should write single-line entries (replace newlines with literal \\n or use repr()).",
      "suggested_fix": null
    }
  ]
}
