{
  "reviewer": "phase-auditor",
  "schema_version": "1.0",
  "iteration": 1,
  "status": "ok",
  "verdict": "approve",
  "findings": [
    {
      "severity": "low",
      "category": "meta",
      "file": "skills/feature-development/ai_review_openai.sh",
      "line": 47,
      "finding": "Shell wrapper duplicates the TLMFORGE_ENABLE_OPENAI + OPENAI_API_KEY pre-flight check that the Python script already handles. The redundancy is harmless — both paths ultimately call the Python script and exit codes pass through unchanged — but it adds dead logic in the shell layer.",
      "suggested_fix": null
    }
  ]
}
