{
  "reviewer": "tester",
  "schema_version": "1.0",
  "iteration": 2,
  "status": "ok",
  "verdict": "needs_revision",
  "findings": [
    {
      "severity": "critical",
      "category": "logic_error",
      "file": "specs/multi-llm-reviewers/README.md",
      "line": "235-238",
      "finding": "NEC-1: Phase 1 test plan specifies status=error for three LLM provider failure scenarios (both calls invalid JSON, auth error, truncated response) — directly contradicts the silent-skip constraint at lines 202-207 which requires ALL provider failures → status=skipped + exit 2",
      "suggested_fix": "Change all three affected test cases to: status=skipped, exit 2, failure reason logged to ~/.cache/tlmforge/llm_reviewer.log. Remove status=error and meta CRITICAL expectations from these paths."
    },
    {
      "severity": "critical",
      "category": "logic_error",
      "file": "specs/multi-llm-reviewers/README.md",
      "line": "374",
      "finding": "NEC-2: Verification criterion 1 expects 'exits 0, JSON has status=error' on fake API key — directly contradicts the silent-skip constraint. A fake key is an auth error (provider failure), which must produce status=skipped + exit 2.",
      "suggested_fix": "Change criterion 1 to: exits 2, JSON has status=skipped, reviewer=\"openai\". Add a separate criterion 1b for the happy path (exits 0, status=ok) using a mocked valid response."
    },
    {
      "severity": "high",
      "category": "missing_error_handling",
      "file": "specs/multi-llm-reviewers/README.md",
      "line": null,
      "finding": "NEC-3: Plan never confirms that review_schema.json accepts 'skipped' as a valid status value, nor does it define the minimum field set required for a status=skipped sidecar. If the schema only allows 'ok' and 'error', all skipped outputs would fail schema validation at convergence time.",
      "suggested_fix": "Explicitly state: (1) review_schema.json status enum already includes 'skipped' (confirmed); (2) minimum skipped sidecar must include: reviewer, schema_version, iteration, status='skipped'. Findings array may be empty. Document this in the constraints or architecture section."
    }
  ]
}
