{
  "reviewer": "code-reviewer",
  "schema_version": "1.0",
  "iteration": 2,
  "status": "ok",
  "verdict": "approve",
  "findings": [
    {
      "severity": "nit",
      "category": "style",
      "file": "skills/feature-development/ai_review_json_openai.py",
      "line": 219,
      "finding": "Empty-diff and plan-mode skip paths call _log_failure() directly before calling skip(), which now also calls _log_failure(). This produces two log entries per skip for these paths, inconsistent with pre-flight skips that log once. The standalone _log_failure() calls at lines 219, 226, 230, 233, 237 are now redundant and can be removed.",
      "suggested_fix": null
    },
    {
      "severity": "low",
      "category": "missing_error_handling",
      "file": "skills/feature-development/ai_review_json_openai.py",
      "line": 189,
      "finding": "The _write_atomic call inside skip() (line 189) is not wrapped in a try/except. If the sidecar write fails at this call site (e.g. disk full during a pre-flight skip), the script exits 1 with a traceback instead of exit 2. The CRIT-2 fix correctly handles the happy-path write site but this call site remains unguarded. Low probability scenario.",
      "suggested_fix": null
    },
    {
      "severity": "low",
      "category": "meta",
      "file": "skills/feature-development/ai_review_openai.sh",
      "line": 47,
      "finding": "Dead branching: the if/else at lines 47-54 checks TLMFORGE_ENABLE_OPENAI and OPENAI_API_KEY but executes identical Python invocations in both branches. The condition result is never used. Pre-existing pattern violation, not introduced by the fixes. Creates a maintenance trap for future conditional logic.",
      "suggested_fix": null
    }
  ]
}
